{
  "artifact": {
    "id": "latency-spec-anthropic-2026-04-20-april-20-2026-25307862",
    "version": 1,
    "source_stage": "integration_design",
    "next_stage": "eval",
    "status": "ready",
    "risk_tier": "medium",
    "execution_lane": "guarded",
    "owner_agent": "Integration Engineer",
    "policy_decision_id": "policy-anthropic-2026-04-20-april-20-2026-25307862",
    "budget_class": "medium",
    "rollback_class": "reversible_deploy",
    "approval_requirements": [],
    "created_at": "2026-04-22T14:17:09Z",
    "updated_at": "2026-04-22T14:17:09Z"
  },
  "spec_packet_id": "spec-anthropic-2026-04-20-april-20-2026-25307862",
  "prompt_contract_id": "prompt-spec-anthropic-2026-04-20-april-20-2026-25307862",
  "pr_packet_id": "pr-spec-anthropic-2026-04-20-april-20-2026-25307862",
  "reference_check_ids": [
    "check-pre-merge-targeted-regression-ticket-bundle-spec-anthropic",
    "check-pre-merge-latency-benchmark-ticket-bundle-spec-anthropic-2",
    "check-pre-merge-cost-benchmark-ticket-bundle-spec-anthropic-2026",
    "check-nightly-full-golden-dataset-ticket-bundle-spec-anthropic-2",
    "check-post-deploy-canary-latency-ticket-bundle-spec-anthropic-20",
    "check-post-deploy-canary-cost-ticket-bundle-spec-anthropic-2026"
  ],
  "baseline": {
    "expected_p50_latency_ms": 1030,
    "expected_p95_latency_ms": 2266,
    "expected_input_tokens": 2900,
    "expected_output_tokens": 1040,
    "expected_cost_per_call_usd": 0.028,
    "expected_quality_score": 0.91
  },
  "thresholds": {
    "max_latency_regression_pct": 10.0,
    "max_cost_regression_pct": 10.0,
    "max_quality_score_delta": 0.1
  },
  "sampling_plan": {
    "sample_size": 300,
    "environment": "staging_equivalent",
    "notes": "Replay the golden dataset plus failure injections before expanding traffic."
  }
}
